[
  {
    "id": "ffuf-dir-fuzz",
    "tool": "ffuf",
    "category": "Web Enumeration",
    "scenario_tags": ["web", "directory-bruteforce", "fuzzing"],
    "platform": "cross-platform",
    "title": "Directory and File Fuzzing",
    "command": "ffuf -w <wordlist> -u http://<target>/FUZZ",
    "description": "Uses a highly optimized Go-based engine to rapidly request URL paths by replacing the 'FUZZ' keyword with entries from a provided wordlist, effectively brute-forcing hidden directories and files.",
    "when_to_use": "This is your primary tool for mapping out the hidden attack surface of a web application. Run this immediately against any discovered web server to find admin panels, backups, or undocumented APIs.",
    "example": "ffuf -w /usr/share/wordlists/dirb/common.txt -u http://10.10.10.10/FUZZ",
    "common_pitfalls": "Failing to filter out false positives. If the server returns a 200 OK for every non-existent page, you must use the '-fc' (filter code) or '-fs' (filter size) flags to hide the noise."
  },
  {
    "id": "ffuf-vhost-fuzz",
    "tool": "ffuf",
    "category": "Web Enumeration",
    "scenario_tags": ["web", "vhost-bruteforce", "fuzzing"],
    "platform": "cross-platform",
    "title": "Virtual Host (VHost) Fuzzing",
    "command": "ffuf -w <wordlist> -u http://<target> -H \"Host: FUZZ.<target>\"",
    "description": "Fuzzes the HTTP 'Host' header to discover subdomains or virtual hosts that are served by the same IP address but aren't publicly listed in DNS.",
    "when_to_use": "Crucial when targeting a single IP that might host multiple internal applications (like 'dev.target.local' or 'admin.target.local') that route differently based on the requested Host header.",
    "example": "ffuf -w /usr/share/wordlists/SecLists/Discovery/DNS/subdomains-top1million-110000.txt -u http://target.com -H \"Host: FUZZ.target.com\" -fs 1234",
    "common_pitfalls": "You absolutely must use size filtering ('-fs') or word filtering ('-fw') here, because the default VHost will usually return a valid 200 response, flooding your results."
  },
  {
    "id": "gobuster-dir",
    "tool": "gobuster",
    "category": "Web Enumeration",
    "scenario_tags": ["web", "directory-bruteforce"],
    "platform": "cross-platform",
    "title": "Directory Brute-Forcing with Extensions",
    "command": "gobuster dir -u http://<target> -w <wordlist> -x <extensions>",
    "description": "A classic directory brute-forcing tool that allows you to easily append specific file extensions (like .php, .txt, .bak) to every wordlist entry during the scan.",
    "when_to_use": "A solid alternative to ffuf when you want a simpler syntax for finding specific file types on a target web server.",
    "example": "gobuster dir -u http://10.10.10.15 -w /usr/share/wordlists/dirbuster/directory-list-2.3-medium.txt -x php,txt,bak",
    "related_ids": ["ffuf-dir-fuzz"]
  },
  {
    "id": "burp-proxy-setup",
    "tool": "Burp Suite",
    "category": "Web Enumeration",
    "scenario_tags": ["web", "proxy", "interception"],
    "platform": "cross-platform",
    "title": "Configure Proxy Interception",
    "command": "FoxyProxy -> Burp (127.0.0.1:8080) | Burp: Proxy -> Intercept is on",
    "description": "The fundamental setup for Burp Suite: routing your browser traffic through Burp's local proxy listener so you can pause, inspect, and modify HTTP requests before they reach the server.",
    "when_to_use": "Mandatory for all manual web application testing. Use this to bypass client-side validation, analyze hidden API requests, or manipulate session cookies.",
    "example": "N/A (GUI action)",
    "common_pitfalls": "Forgetting to install PortSwigger's CA certificate in your browser, which will cause all HTTPS sites to throw severe security warnings."
  },
  {
    "id": "burp-repeater",
    "tool": "Burp Suite",
    "category": "Web Enumeration",
    "scenario_tags": ["web", "manual-testing", "repeater"],
    "platform": "cross-platform",
    "title": "Send to Repeater (Shortcut)",
    "command": "Ctrl + R (Windows/Linux) or Cmd + R (Mac)",
    "description": "Quickly sends an intercepted HTTP request to the 'Repeater' tab. Repeater allows you to manually tweak parameters and replay the exact same request endlessly to observe the server's response.",
    "when_to_use": "Use this constantly when probing an endpoint for vulnerabilities like SQL Injection, XSS, or IDOR, as it saves you from having to click through the actual website UI over and over.",
    "example": "N/A (GUI action)"
  },
  {
    "id": "nikto-basic",
    "tool": "nikto",
    "category": "Web Enumeration",
    "scenario_tags": ["web", "vulnerability-scanning"],
    "platform": "linux",
    "title": "Basic Web Server Vulnerability Scan",
    "command": "nikto -h <target>",
    "description": "A classic, noisy web vulnerability scanner that checks web servers for thousands of outdated files, misconfigurations, and known insecure software versions.",
    "when_to_use": "Run this in the background early in an engagement. While it generates many false positives, it excels at quickly identifying missing security headers, default index pages, or ancient server software.",
    "example": "nikto -h http://10.10.10.20",
    "common_pitfalls": "Extremely noisy and signature-heavy. It will light up a target's Intrusion Detection System instantly."
  },
  {
    "id": "wpscan-enum",
    "tool": "wpscan",
    "category": "Web Enumeration",
    "scenario_tags": ["web", "cms", "wordpress"],
    "platform": "linux",
    "title": "Aggressive WordPress Enumeration",
    "command": "wpscan --url <target> --enumerate vp,vt,u",
    "description": "A specialized scanner for WordPress environments. This command specifically enumerates vulnerable plugins ('vp'), vulnerable themes ('vt'), and registered users ('u').",
    "when_to_use": "The absolute first tool you should reach for whenever you detect a target is running WordPress. Identifying a vulnerable plugin is the most common path to compromising a WP site.",
    "example": "wpscan --url http://blog.target.com --enumerate vp,vt,u --api-token <your_token>",
    "common_pitfalls": "Without supplying a free Wpscan API token, the tool will enumerate the plugins but will NOT tell you if they have known vulnerabilities."
  },
  {
    "id": "sqlmap-auto",
    "tool": "sqlmap",
    "category": "Web Enumeration",
    "scenario_tags": ["web", "exploitation", "sqli"],
    "platform": "cross-platform",
    "title": "Automated SQL Injection Testing",
    "command": "sqlmap -u \"<target_url>\" --batch --dbs",
    "description": "Automatically tests a URL parameter for SQL injection vulnerabilities. If successful, it exploits the flaw to list all databases ('--dbs') available on the backend server. The '--batch' flag accepts default prompts without user interaction.",
    "when_to_use": "Use this when you suspect a URL parameter (e.g., '?id=1') or a POST body field is vulnerable to SQL injection, but you want to automate the tedious payload generation and database dumping process.",
    "example": "sqlmap -u \"http://10.10.10.30/view.php?id=1\" --batch --dbs",
    "common_pitfalls": "Can accidentally corrupt database records if testing against fragile production applications. Never run blindly against untested targets."
  },
  {
    "id": "sqlmap-request-file",
    "tool": "sqlmap",
    "category": "Web Enumeration",
    "scenario_tags": ["web", "exploitation", "sqli", "burp"],
    "platform": "cross-platform",
    "title": "SQLMap via Intercepted Request File",
    "command": "sqlmap -r <request_file> -p <parameter> --dump",
    "description": "Instructs SQLMap to parse a raw HTTP request saved to a text file (usually exported directly from Burp Suite) and target a specific parameter for injection, ultimately attempting to dump the tables.",
    "when_to_use": "Crucial when the SQL injection is in a complex POST request, an authenticated session with specific cookies, or hidden within HTTP headers, which are difficult to supply via the command line.",
    "example": "sqlmap -r login_request.txt -p username --dump"
  }
]
