[
  {
    "id": "hydra-ssh-brute",
    "tool": "hydra",
    "category": "Password Attacks",
    "scenario_tags": ["passwords", "online-bruteforce", "ssh"],
    "platform": "cross-platform",
    "title": "SSH Brute-Force (Single User, Wordlist)",
    "command": "hydra -l <username> -P <wordlist> ssh://<target>",
    "description": "Attempts to brute-force the SSH password for a known username by iterating through a provided wordlist. Hydra is exceptionally fast but easily detected by defensive tools like Fail2Ban.",
    "when_to_use": "Use this when you have enumerated a valid username on the target (e.g., 'root' or 'admin') and suspect they might be using a weak or default password.",
    "example": "hydra -l root -P /usr/share/wordlists/rockyou.txt ssh://10.10.10.40",
    "common_pitfalls": "Default thread counts might crash older SSH servers or trigger aggressive lockout policies immediately."
  },
  {
    "id": "hydra-http-post",
    "tool": "hydra",
    "category": "Password Attacks",
    "scenario_tags": ["passwords", "online-bruteforce", "web-login"],
    "platform": "cross-platform",
    "title": "HTTP POST Form Brute-Force",
    "command": "hydra -l <username> -P <wordlist> <target> http-post-form \"<path>:<post_body>:<failure_string>\"",
    "description": "Targeting a web application's login form. You must provide the exact HTTP path, the structure of the POST body (with ^USER^ and ^PASS^ as placeholders), and a string that appears only when the login fails.",
    "when_to_use": "Essential for brute-forcing custom web application logins, WordPress admin panels, or internal portals that do not implement rate limiting or CAPTCHAs.",
    "example": "hydra -l admin -P rockyou.txt 10.10.10.50 http-post-form \"/login.php:user=^USER^&pass=^PASS^:Incorrect password\"",
    "common_pitfalls": "Getting the failure string wrong will result in 100% false positives, where Hydra thinks every password worked. Always manually test a failed login first."
  },
  {
    "id": "john-auto",
    "tool": "John the Ripper",
    "category": "Password Attacks",
    "scenario_tags": ["passwords", "offline-cracking", "rockyou"],
    "platform": "cross-platform",
    "title": "Automated Hash Cracking (Wordlist)",
    "command": "john --wordlist=<wordlist> <hash_file>",
    "description": "The fundamental command for offline cracking. John the Ripper attempts to automatically identify the hash type in the file and uses the provided wordlist to crack it.",
    "when_to_use": "Your first step after extracting password hashes (e.g., from an /etc/shadow file or a database dump). If you aren't sure what hash type it is, John is usually very good at guessing.",
    "example": "john --wordlist=/usr/share/wordlists/rockyou.txt hashes.txt"
  },
  {
    "id": "john-show",
    "tool": "John the Ripper",
    "category": "Password Attacks",
    "scenario_tags": ["passwords", "offline-cracking", "results"],
    "platform": "cross-platform",
    "title": "Show Cracked Passwords",
    "command": "john --show <hash_file>",
    "description": "Displays the plaintext passwords that have already been successfully cracked and saved in John's internal potfile.",
    "when_to_use": "Run this after a long cracking session finishes to clearly view the results mapped to their original usernames or identifiers.",
    "example": "john --show hashes.txt"
  },
  {
    "id": "hashcat-md5",
    "tool": "hashcat",
    "category": "Password Attacks",
    "scenario_tags": ["passwords", "offline-cracking", "gpu"],
    "platform": "cross-platform",
    "title": "Crack MD5 Hashes (Wordlist Mode)",
    "command": "hashcat -m 0 -a 0 <hash_file> <wordlist>",
    "description": "Uses Hashcat's immense GPU cracking power to brute-force MD5 hashes (mode 0) using a straight wordlist attack (attack mode 0).",
    "when_to_use": "When you have a large number of basic MD5 hashes and want to utilize your computer's GPU for maximum cracking speed, which John the Ripper (CPU-focused) cannot match.",
    "example": "hashcat -m 0 -a 0 md5_hashes.txt /usr/share/wordlists/rockyou.txt",
    "related_ids": ["john-auto"],
    "further_reading": [
      {
        "label": "Hashcat Hash Mode Reference",
        "url": "https://hashcat.net/wiki/doku.php?id=example_hashes"
      }
    ]
  },
  {
    "id": "hashcat-ntlm",
    "tool": "hashcat",
    "category": "Password Attacks",
    "scenario_tags": ["passwords", "offline-cracking", "windows-ad"],
    "platform": "cross-platform",
    "title": "Crack Windows NTLM Hashes",
    "command": "hashcat -m 1000 -a 0 <hash_file> <wordlist>",
    "description": "Targets the NTLM hash algorithm (mode 1000) used locally by Windows and across Active Directory domains. This is one of the most common and fastest hashes to crack.",
    "when_to_use": "Immediately after dumping the local SAM database from a Windows machine or extracting the NTDS.dit file from a Domain Controller.",
    "example": "hashcat -m 1000 -a 0 ntlm_dump.txt rockyou.txt"
  }
]
